{"$schema":"https://json-schema.org/draft/2020-12/schema","$id":"qingshan.agentcut.shot_recipe_contract_fixture.v1","title":"Provisional AgentCut shot recipe compatibility fixture","description":"Versioned Task5 adapter fixture pending Task4 final schema. Fields outside this contract are not interpreted as authoritative.","type":"object","required":["candidate_sha256","project_id","project_version"],"properties":{"candidate_sha256":{"type":"string","pattern":"^[a-f0-9]{64}$"},"project_id":{"type":"string","minLength":1},"project_version":{"type":"string","minLength":1},"timeline_provenance":{"type":"object","required":["timeline_evidence_sha256"],"properties":{"timeline_evidence_sha256":{"type":"string","pattern":"^[a-f0-9]{64}$"}}},"recipes":{"type":"array","items":{"type":"object","required":["recipe_id","clip_id"],"properties":{"recipe_id":{"type":"string"},"clip_id":{"type":"string"},"applicability":{"type":"object","additionalProperties":{"enum":["REQUIRED","OPTIONAL","NOT_APPLICABLE"]}},"camera_motion":{"type":"object"},"subject_anchor":{"type":"object"},"action":{"type":"object"},"transition":{"type":"object"},"sfx_cues":{"type":"array"},"readability":{"type":"array"},"intentional_effects":{"type":"array","items":{"type":"object","required":["effect","start_frame","end_frame","reason","approved_policy"],"properties":{"effect":{"enum":["black","strobe"]},"start_frame":{"type":"integer","minimum":0},"end_frame":{"type":"integer","minimum":0},"reason":{"type":"string","minLength":1},"approved_policy":{"type":"string","minLength":1}}}}}}}}}
