{"candidate_sha256":"aaaaaaaaaaaaaaaaaaaaaaaaaaaaaaaaaaaaaaaaaaaaaaaaaaaaaaaaaaaaaaaa","project_id":"fixture-project","project_version":"1","timeline_provenance":{"timeline_evidence_sha256":"2bd40c6f73f6232d7d61c7cfbb95c83fc15769d629861f51416d3c90b78c46bf"},"recipes":[{"recipe_id":"R1","clip_id":"C1","camera_motion":{"type":"push","phases":[{"phase":"enter"},{"phase":"sustain"},{"phase":"settle"}],"max_curve_rmse":0.05},"subject_anchor":{"target":"lead_face","tolerance_px":5},"action":{"required_phases":["setup","contact","result"],"result_hold_frames":12},"transition":{"beat_id":"B1","offset_frames":0,"tolerance_frames":2},"sfx_cues":[{"cue_id":"hit","action_frame":48,"tolerance_frames":2}],"readability":[{"element_id":"evidence","text":"6000","min_pixel_height":24}],"intentional_effects":[{"effect":"black","start_frame":90,"end_frame":92,"reason":"approved scene transition","approved_policy":"fixture.intentional_black.v1"}]}]}
